<?xml version="1.0" encoding="UTF-8"?>
<xs:schema xmlns:xs="http://www.w3.org/2001/XMLSchema">

    <xs:element name="StudentRoster">
        <xs:complexType>
            <xs:sequence>
                <xs:element ref="Student" maxOccurs="unbounded" />
            </xs:sequence>
        </xs:complexType>
    </xs:element>

    <xs:element name="Student">
        <xs:complexType>
            <xs:sequence>
                <xs:element name="Name" type="xs:string" />
                <xs:element name="Gender" type="GenderType" />
                <xs:element name="Age" type="AgeType" />
            </xs:sequence>
            <xs:attribute name="id" type="xs:string" use="required" />
        </xs:complexType>
    </xs:element>

    <xs:simpleType name="GenderType">
        <xs:restriction base="xs:string">
            <xs:enumeration value="Male" />
            <xs:enumeration value="Female" />
        </xs:restriction>
    </xs:simpleType>

    <xs:simpleType name="AgeType">
        <xs:restriction base="xs:integer">
            <xs:minInclusive value="1" />
            <xs:maxInclusive value="150" />
        </xs:restriction>
    </xs:simpleType>

</xs:schema>